,text,label,text_token,text_string,text_string_fdist,text_string_lem
0,so there is no way for me to plug it in here in the us unless i go by a converter,0,"['way', 'plug', 'us', 'unless', 'go', 'converter']",way plug unless converter,way plug unless converter,way plug unless converter
1,good case excellent value,1,"['good', 'case', 'excellent', 'value']",good case excellent value,good case excellent value,good case excellent value
2,great for the jawbone,1,"['great', 'jawbone']",great jawbone,great jawbone,great jawbone
3,tied to charger for conversations lasting more than 45 minutesmajor problems,0,"['tied', 'charger', 'conversations', 'lasting', '45', 'minutesmajor', 'problems']",tied charger conversations lasting minutesmajor problems,tied charger conversations lasting minutesmajor problems,tied charger conversations lasting minutesmajor problems
4,the mic is great,1,"['mic', 'great']",mic great,mic great,mic great
5,i have to jiggle the plug to get it to line up right to get decent volume,0,"['jiggle', 'plug', 'get', 'line', 'right', 'get', 'decent', 'volume']",jiggle plug get line right get decent volume,jiggle plug get line right get decent volume,jiggle plug get line right get decent volume
6,if you have several dozen or several hundred contacts then imagine the fun of sending each of them one by one,0,"['several', 'dozen', 'several', 'hundred', 'contacts', 'imagine', 'fun', 'sending', 'one', 'one']",several dozen several hundred contacts imagine fun sending one one,several dozen several hundred contacts imagine fun sending one one,several dozen several hundred contacts imagine fun sending one one
7,if you are razr owneryou must have this,1,"['razr', 'owneryou', 'must']",razr owneryou must,razr owneryou must,razr owneryou must
8,needless to say i wasted my money,0,"['needless', 'say', 'wasted', 'money']",needless say wasted money,needless say wasted money,needless say wasted money
9,what a waste of money and time,0,"['waste', 'money', 'time']",waste money time,waste money time,waste money time
10,and the sound quality is great,1,"['sound', 'quality', 'great']",sound quality great,sound quality great,sound quality great
11,he was very impressed when going from the original battery to the extended battery,1,"['impressed', 'going', 'original', 'battery', 'extended', 'battery']",impressed going original battery extended battery,impressed going original battery extended battery,impressed going original battery extended battery
12,if the two were seperated by a mere 5+ ft i started to notice excessive static and garbled sound from the headset,0,"['two', 'seperated', 'mere', '5', 'ft', 'started', 'notice', 'excessive', 'static', 'garbled', 'sound', 'headset']",two seperated mere started notice excessive static garbled sound headset,two seperated mere started notice excessive static garbled sound headset,two seperated mere started notice excessive static garbled sound headset
13,very good quality though,1,"['good', 'quality', 'though']",good quality though,good quality though,good quality though
14,the design is very odd as the ear clip is not very comfortable at all,0,"['design', 'odd', 'ear', 'clip', 'comfortable']",design odd ear clip comfortable,design odd ear clip comfortable,design odd ear clip comfortable
15,highly recommend for any one who has a blue tooth phone,1,"['highly', 'recommend', 'one', 'blue', 'tooth', 'phone']",highly recommend one blue tooth phone,highly recommend one blue tooth phone,highly recommend one blue tooth phone
16,i advise everyone do not be fooled,0,"['advise', 'everyone', 'fooled']",advise everyone fooled,advise everyone fooled,advise everyone fooled
17,so far so good,1,"['far', 'good']",far good,far good,far good
18,works great,1,"['works', 'great']",works great,works great,works great
19,it clicks into place in a way that makes you wonder how long that mechanism would last,0,"['clicks', 'place', 'way', 'makes', 'wonder', 'long', 'mechanism', 'would', 'last']",clicks place way makes wonder long mechanism would last,clicks place way makes wonder long mechanism would last,clicks place way makes wonder long mechanism would last
20,i went on motorola's website and followed all directions but could not get it to pair again,0,"['went', 'motorola', 'website', 'followed', 'directions', 'could', 'get', 'pair']",went motorola website followed directions could get pair,went motorola website followed directions could get pair,went motorola website followed directions could get pair
21,i bought this to use with my kindle fire and absolutely loved it,1,"['bought', 'use', 'kindle', 'fire', 'absolutely', 'loved']",bought use kindle fire absolutely loved,bought use kindle fire absolutely loved,bought use kindle fire absolutely loved
22,the commercials are the most misleading,0,"['commercials', 'misleading']",commercials misleading,commercials misleading,commercials misleading
23,i have yet to run this new battery below two bars and that's three days without charging,1,"['yet', 'run', 'new', 'battery', 'two', 'bars', 'three', 'days', 'without', 'charging']",yet run new battery two bars three days without charging,yet run new battery two bars three days without charging,yet run new battery two bars three days without charging
24,i bought it for my mother and she had a problem with the battery,0,"['bought', 'mother', 'problem', 'battery']",bought mother problem battery,bought mother problem battery,bought mother problem battery
25,great pocket pc / phone combination,1,"['great', 'pocket', 'pc', 'phone', 'combination']",great pocket phone combination,great pocket phone combination,great pocket phone combination
26,i've owned this phone for 7 months now and can say that it's the best mobile phone i've had,1,"['owned', 'phone', '7', 'months', 'say', 'best', 'mobile', 'phone']",owned phone months say best mobile phone,owned phone months say best mobile phone,owned phone months say best mobile phone
27,i didn't think that the instructions provided were helpful to me,0,"['think', 'instructions', 'provided', 'helpful']",think instructions provided helpful,think instructions provided helpful,think instructions provided helpful
28,people couldnt hear me talk and i had to pull out the earphone and talk on the phone,0,"['people', 'couldnt', 'hear', 'talk', 'pull', 'earphone', 'talk', 'phone']",people couldnt hear talk pull earphone talk phone,people couldnt hear talk pull earphone talk phone,people couldnt hear talk pull earphone talk phone
29,doesn't hold charge,0,"['hold', 'charge']",hold charge,hold charge,hold charge
30,this is a simple little phone to use but the breakage is unacceptible,0,"['simple', 'little', 'phone', 'use', 'breakage', 'unacceptible']",simple little phone use breakage unacceptible,simple little phone use breakage unacceptible,simple little phone use breakage unacceptible
31,this product is ideal for people like me whose ears are very sensitive,1,"['product', 'ideal', 'people', 'like', 'whose', 'ears', 'sensitive']",product ideal people like whose ears sensitive,product ideal people like whose ears sensitive,product ideal people like whose ears sensitive
32,it is unusable in a moving car at freeway speed,0,"['unusable', 'moving', 'car', 'freeway', 'speed']",unusable moving car freeway speed,unusable moving car freeway speed,unusable moving car freeway speed
33,i have two more years left in this contract and i hate this phone,0,"['two', 'years', 'left', 'contract', 'hate', 'phone']",two years left contract hate phone,two years left contract hate phone,two years left contract hate phone
34,car charger as well as ac charger are included to make sure you never run out of juicehighy recommended,1,"['car', 'charger', 'well', 'ac', 'charger', 'included', 'make', 'sure', 'never', 'run', 'juicehighy', 'recommended']",car charger well charger included make sure never run juicehighy recommended,car charger well charger included make sure never run juicehighy recommended,car charger well charger included make sure never run juicehighy recommended
35,you need at least 3 mins to get to your phone book from the time you first turn on the phonebattery life is short,0,"['need', 'least', '3', 'mins', 'get', 'phone', 'book', 'time', 'first', 'turn', 'phonebattery', 'life', 'short']",need least mins get phone book time first turn phonebattery life short,need least mins get phone book time first turn phonebattery life short,need least mins get phone book time first turn phonebattery life short
36,it has kept up very well,1,"['kept', 'well']",kept well,kept well,kept well
37,poor talk time performance,0,"['poor', 'talk', 'time', 'performance']",poor talk time performance,poor talk time performance,poor talk time performance
38,the case is great and works fine with the 680,1,"['case', 'great', 'works', 'fine', '680']",case great works fine 680,case great works fine 680,case great works fine 680
39,worthless product,0,"['worthless', 'product']",worthless product,worthless product,worthless product
40,it has a great camera thats 2mp and the pics are nice and clear with great picture quality,1,"['great', 'camera', 'thats', '2mp', 'pics', 'nice', 'clear', 'great', 'picture', 'quality']",great camera thats 2mp pics nice clear great picture quality,great camera thats 2mp pics nice clear great picture quality,great camera thats 2mp pics nice clear great picture quality
41,i was not impressed by this product,0,"['impressed', 'product']",impressed product,impressed product,impressed product
42,nice headset priced right,1,"['nice', 'headset', 'priced', 'right']",nice headset priced right,nice headset priced right,nice headset priced right
43,i only hear garbage for audio,0,"['hear', 'garbage', 'audio']",hear garbage audio,hear garbage audio,hear garbage audio
44,excellent bluetooth headset,1,"['excellent', 'bluetooth', 'headset']",excellent bluetooth headset,excellent bluetooth headset,excellent bluetooth headset
45,it has all the features i want,1,"['features', 'want']",features want,features want,features want
46,who in their right mind is gonna buy this battery,0,"['right', 'mind', 'gonna', 'buy', 'battery']",right mind gonna buy battery,right mind buy battery,right mind buy battery
47,after arguing with verizon regarding the dropped calls we returned the phones after two days,0,"['arguing', 'verizon', 'regarding', 'dropped', 'calls', 'returned', 'phones', 'two', 'days']",arguing verizon regarding dropped calls returned phones two days,arguing verizon regarding dropped calls returned phones two days,arguing verizon regarding dropped calls returned phones two days
48,this case seems well made,1,"['case', 'seems', 'well', 'made']",case seems well made,case seems well made,case seems well made
49,disappointed with battery,0,"['disappointed', 'battery']",disappointed battery,disappointed battery,disappointed battery
50,not loud enough and doesn't turn on like it should,0,"['loud', 'enough', 'turn', 'like']",loud enough turn like,loud enough turn like,loud enough turn like
51,good protection and does not make phone too bulky,1,"['good', 'protection', 'make', 'phone', 'bulky']",good protection make phone bulky,good protection make phone bulky,good protection make phone bulky
52,a usable keyboard actually turns a pda into a real-world useful machine instead of just a neat gadget,1,"['usable', 'keyboard', 'actually', 'turns', 'pda', 'real', 'world', 'useful', 'machine', 'instead', 'neat', 'gadget']",usable keyboard actually turns pda real world useful machine instead neat gadget,usable keyboard actually turns pda real world useful machine instead neat gadget,usable keyboard actually turns pda real world useful machine instead neat gadget
53,this phone is pretty sturdy and i've never had any large problems with it,1,"['phone', 'pretty', 'sturdy', 'never', 'large', 'problems']",phone pretty sturdy never large problems,phone pretty sturdy never large problems,phone pretty sturdy never large problems
54,i love this thing,1,"['love', 'thing']",love thing,love thing,love thing
55,everything about it is fine and reasonable for the price ie,1,"['everything', 'fine', 'reasonable', 'price', 'ie']",everything fine reasonable price,everything fine reasonable price,everything fine reasonable price
56,very disappointed,0,['disappointed'],disappointed,disappointed,disappointed
57,i even dropped this phone into a stream and it was submerged for 15 seconds and it still works great,1,"['even', 'dropped', 'phone', 'stream', 'submerged', '15', 'seconds', 'still', 'works', 'great']",even dropped phone stream submerged seconds still works great,even dropped phone stream submerged seconds still works great,even dropped phone stream submerged seconds still works great
58,i have been very happy with the 510 and have had no complaints from any one regarding my sound quality on their end,1,"['happy', '510', 'complaints', 'one', 'regarding', 'sound', 'quality', 'end']",happy 510 complaints one regarding sound quality end,happy 510 complaints one regarding sound quality end,happy 510 complaints one regarding sound quality end
59,the buttons for on and off are bad,0,"['buttons', 'bad']",buttons bad,buttons bad,buttons bad
60,essentially you can forget microsoft's tech support,0,"['essentially', 'forget', 'microsoft', 'tech', 'support']",essentially forget microsoft tech support,essentially forget microsoft tech support,essentially forget microsoft tech support
61,i really recommend this faceplates since it looks very nice elegant and cool,1,"['really', 'recommend', 'faceplates', 'since', 'looks', 'nice', 'elegant', 'cool']",really recommend faceplates since looks nice elegant cool,really recommend faceplates since looks nice elegant cool,really recommend faceplates since looks nice elegant cool
62,these headphones were a great find - and i think they are perhaps the best purchase i've made in the last several years - seriously,1,"['headphones', 'great', 'find', 'think', 'perhaps', 'best', 'purchase', 'made', 'last', 'several', 'years', 'seriously']",headphones great find think perhaps best purchase made last several years seriously,headphones great find think perhaps best purchase made last several years seriously,headphones great find think perhaps best purchase made last several years seriously
63,buy a different phone - but not this,0,"['buy', 'different', 'phone']",buy different phone,buy different phone,buy different phone
64,you have to hold the phone at a particular angle for the other party to hear you clearly,0,"['hold', 'phone', 'particular', 'angle', 'party', 'hear', 'clearly']",hold phone particular angle party hear clearly,hold phone particular angle party hear clearly,hold phone particular angle party hear clearly
65,the one big drawback of the mp3 player is that the buttons on the phone's front cover that let you pause and skip songs lock out after a few seconds,0,"['one', 'big', 'drawback', 'mp3', 'player', 'buttons', 'phone', 'front', 'cover', 'let', 'pause', 'skip', 'songs', 'lock', 'seconds']",one big drawback mp3 player buttons phone front cover let pause skip songs lock seconds,one big drawback mp3 player buttons phone front cover let pause skip songs lock seconds,one big drawback mp3 player buttons phone front cover let pause skip songs lock seconds
66,a week later after i activated it it suddenly died,0,"['week', 'later', 'activated', 'suddenly', 'died']",week later activated suddenly died,week later activated suddenly died,week later activated suddenly died
67,it feels more comfortable than most headsets because i wear glasses and that gets in the way sometimes,1,"['feels', 'comfortable', 'headsets', 'wear', 'glasses', 'gets', 'way', 'sometimes']",feels comfortable headsets wear glasses gets way sometimes,feels comfortable headsets wear glasses gets way sometimes,feels comfortable headsets wear glasses gets way sometimes
68,great for ipods too,1,"['great', 'ipods']",great ipods,great ipods,great ipods
69,this device is great in several situations1),1,"['device', 'great', 'several', 'situations1']",device great several situations1,device great several situations1,device great several situations1
70,mic doesn't work,0,"['mic', 'work']",mic work,mic work,mic work
71,even in my bmw 3 series which is fairly quiet i have trouble hearing what the other person is saying,0,"['even', 'bmw', '3', 'series', 'fairly', 'quiet', 'trouble', 'hearing', 'person', 'saying']",even bmw series fairly quiet trouble hearing person saying,even bmw series fairly quiet trouble hearing person saying,even bmw series fairly quiet trouble hearing person saying
72,great choice,1,"['great', 'choice']",great choice,great choice,great choice
73,nice docking station for home or work,1,"['nice', 'docking', 'station', 'home', 'work']",nice docking station home work,nice docking station home work,nice docking station home work
74,this is a beautiful phone,1,"['beautiful', 'phone']",beautiful phone,beautiful phone,beautiful phone
75,love this product,1,"['love', 'product']",love product,love product,love product
76,do not buy for d807wrongly advertised for d807,0,"['buy', 'd807wrongly', 'advertised', 'd807']",buy d807wrongly advertised d807,buy d807wrongly advertised d807,buy d807wrongly advertised d807
77,this is a great little item,1,"['great', 'little', 'item']",great little item,great little item,great little item
78,i love this phone  it is very handy and has a lot of features ,1,"['love', 'phone', 'handy', 'lot', 'features']",love phone handy lot features,love phone handy lot features,love phone handy lot features
79,i purchased this and within 2 days it was no longer working,0,"['purchased', 'within', '2', 'days', 'longer', 'working']",purchased within days longer working,purchased within days longer working,purchased within days longer working
80,i wear it everyday and it holds up very well,1,"['wear', 'everyday', 'holds', 'well']",wear everyday holds well,wear everyday holds well,wear everyday holds well
81,not a good bargain,0,"['good', 'bargain']",good bargain,good bargain,good bargain
82,well packaged arrived on time and works as intended,1,"['well', 'packaged', 'arrived', 'time', 'works', 'intended']",well packaged arrived time works intended,well packaged arrived time works intended,well packaged arrived time works intended
83,the battery runs down quickly,0,"['battery', 'runs', 'quickly']",battery runs quickly,battery runs quickly,battery runs quickly
84,this item worked great but it broke after 6 months of use,0,"['item', 'worked', 'great', 'broke', '6', 'months', 'use']",item worked great broke months use,item worked great broke months use,item worked great broke months use
85,the headsets are easy to use and everyone loves them,1,"['headsets', 'easy', 'use', 'everyone', 'loves']",headsets easy use everyone loves,headsets easy use everyone loves,headsets easy use everyone loves
86,this phone works great,1,"['phone', 'works', 'great']",phone works great,phone works great,phone works great
87,the construction of the headsets is poor,0,"['construction', 'headsets', 'poor']",construction headsets poor,construction headsets poor,construction headsets poor
88,product was excellent and works better than the verizon one and boy was it cheaper,1,"['product', 'excellent', 'works', 'better', 'verizon', 'one', 'boy', 'cheaper']",product excellent works better verizon one boy cheaper,product excellent works better verizon one boy cheaper,product excellent works better verizon one boy cheaper
89,the phone loads super,1,"['phone', 'loads', 'super']",phone loads super,phone loads super,phone loads super
90,for a product that costs as much as this one does i expect it to work far better and with greater ease than this thing does,0,"['product', 'costs', 'much', 'one', 'expect', 'work', 'far', 'better', 'greater', 'ease', 'thing']",product costs much one expect work far better greater ease thing,product costs much one expect work far better greater ease thing,product costs much one expect work far better greater ease thing
91,made very sturdy,1,"['made', 'sturdy']",made sturdy,made sturdy,made sturdy
92,worked great,1,"['worked', 'great']",worked great,worked great,worked great
93,the ear buds only play music in one ear,0,"['ear', 'buds', 'play', 'music', 'one', 'ear']",ear buds play music one ear,ear buds play music one ear,ear buds play music one ear
94,dont waste your money,0,"['dont', 'waste', 'money']",dont waste money,dont waste money,dont waste money
95,will order from them again,1,['order'],order,order,order
96,if you plan to use this in a car forget about it,0,"['plan', 'use', 'car', 'forget']",plan use car forget,plan use car forget,plan use car forget
97,i found this product to be waaay too big,0,"['found', 'product', 'waaay', 'big']",found product waaay big,found product waaay big,found product waaay big
98,best i've found so far  i've tried 2 other bluetooths and this one has the best quality (for both me and the listener) as well as ease of using,1,"['best', 'found', 'far', 'tried', '2', 'bluetooths', 'one', 'best', 'quality', 'listener', 'well', 'ease', 'using']",best found far tried bluetooths one best quality listener well ease using,best found far tried bluetooths one best quality listener well ease using,best found far tried bluetooths one best quality listener well ease using
99,i'm very disappointed with my decision,0,"['disappointed', 'decision']",disappointed decision,disappointed decision,disappointed decision
100,integrated seamlessly with the motorola razr phone,1,"['integrated', 'seamlessly', 'motorola', 'razr', 'phone']",integrated seamlessly motorola razr phone,integrated seamlessly motorola razr phone,integrated seamlessly motorola razr phone
101,buyer beware you could flush money right down the toilet,0,"['buyer', 'beware', 'could', 'flush', 'money', 'right', 'toilet']",buyer beware could flush money right toilet,buyer beware could flush money right toilet,buyer beware could flush money right toilet
102,definitely a bargain,1,"['definitely', 'bargain']",definitely bargain,definitely bargain,definitely bargain
103,the price was very good and with the free shipping and all it was a good purchase,1,"['price', 'good', 'free', 'shipping', 'good', 'purchase']",price good free shipping good purchase,price good free shipping good purchase,price good free shipping good purchase
104,i received my supposedly new motorola 375 and apparently there was not a match between the phone and the charger,0,"['received', 'supposedly', 'new', 'motorola', '375', 'apparently', 'match', 'phone', 'charger']",received supposedly new motorola 375 apparently match phone charger,received supposedly new motorola 375 apparently match phone charger,received supposedly new motorola 375 apparently match phone charger
105,pros-good camera - very nice pictures  also has cool styles like black and white and more,1,"['pros', 'good', 'camera', 'nice', 'pictures', 'also', 'cool', 'styles', 'like', 'black', 'white']",pros good camera nice pictures also cool styles like black white,pros good camera nice pictures also cool styles like black white,pros good camera nice pictures also cool styles like black white
106,that's a huge design flaw (unless i'm not using it correctly which i don't think is the case),0,"['huge', 'design', 'flaw', 'unless', 'using', 'correctly', 'think', 'case']",huge design flaw unless using correctly think case,huge design flaw unless using correctly think case,huge design flaw unless using correctly think case
107,i love my 350 headset my jabra350 bluetooth headset is great the reception is very good and the ear piece is a comfortable fit,1,"['love', '350', 'headset', 'jabra350', 'bluetooth', 'headset', 'great', 'reception', 'good', 'ear', 'piece', 'comfortable', 'fit']",love 350 headset jabra350 bluetooth headset great reception good ear piece comfortable fit,love 350 headset jabra350 bluetooth headset great reception good ear piece comfortable fit,love 350 headset jabra350 bluetooth headset great reception good ear piece comfortable fit
108,the camera although rated at an impressive 13 megapixels renders images that fall well below expectations of such a relatively high resolution,0,"['camera', 'although', 'rated', 'impressive', '13', 'megapixels', 'renders', 'images', 'fall', 'well', 'expectations', 'relatively', 'high', 'resolution']",camera although rated impressive megapixels renders images fall well expectations relatively high resolution,camera although rated impressive megapixels renders images fall well expectations relatively high resolution,camera although rated impressive megapixels renders images fall well expectations relatively high resolution
109,i purcashed this for the car charger and it does not work,0,"['purcashed', 'car', 'charger', 'work']",purcashed car charger work,purcashed car charger work,purcashed car charger work
110,sound quality on both end is excellent i use headset to call my wife and ask my wife to use headset to call me 2,1,"['sound', 'quality', 'end', 'excellent', 'use', 'headset', 'call', 'wife', 'ask', 'wife', 'use', 'headset', 'call', '2']",sound quality end excellent use headset call wife ask wife use headset call,sound quality end excellent use headset call wife ask wife use headset call,sound quality end excellent use headset call wife ask wife use headset call
111,this phone is slim and light and the display is beautiful,1,"['phone', 'slim', 'light', 'display', 'beautiful']",phone slim light display beautiful,phone slim light display beautiful,phone slim light display beautiful
