,text,label,text_token,text_string,text_string_fdist,text_string_lem
1339,putting the race card aside lets look at the major flaw in the film they destroy latifa's character  ,0,"['putting', 'race', 'card', 'aside', 'lets', 'look', 'major', 'flaw', 'film', 'destroy', 'latifa', 'character']",putting race card aside lets look major flaw film destroy latifa character,putting race card aside lets look major flaw film destroy latifa character,putting race card aside lets look major flaw film destroy latifa character
1340,there is no real plot  ,0,"['real', 'plot']",real plot,real plot,real plot
1341,i wouldnt see this movie again for free  ,0,"['wouldnt', 'see', 'movie', 'free']",wouldnt see movie free,wouldnt see movie free,wouldnt see movie free
1342,steamboat willie is an amazingly important film to our cinema history  ,1,"['steamboat', 'willie', 'amazingly', 'important', 'film', 'cinema', 'history']",steamboat willie amazingly important film cinema history,steamboat willie amazingly important film cinema history,steamboat willie amazingly important film cinema history
1343,this second appearance of mickey mouse (following the silent plane crazy earlier that year) is probably his most famous film--mostly because it was so ground-breaking  ,1,"['second', 'appearance', 'mickey', 'mouse', 'following', 'silent', 'plane', 'crazy', 'earlier', 'year', 'probably', 'famous', 'film', 'mostly', 'ground', 'breaking']",second appearance mickey mouse following silent plane crazy earlier year probably famous film mostly ground breaking,second appearance mickey mouse following silent plane crazy earlier year probably famous film mostly ground breaking,second appearance mickey mouse following silent plane crazy earlier year probably famous film mostly ground breaking
1344,while you don't yet hear mickey speak there are tons of sound effects and music throughout the film--something we take for granted now but which was a huge crowd pleaser in 1928  ,1,"['yet', 'hear', 'mickey', 'speak', 'tons', 'sound', 'effects', 'music', 'throughout', 'film', 'something', 'take', 'granted', 'huge', 'crowd', 'pleaser', '1928']",yet hear mickey speak tons sound effects music throughout film something take granted huge crowd pleaser 1928,yet hear mickey speak tons sound effects music throughout film something take granted huge crowd pleaser 1928,yet hear mickey speak tons sound effects music throughout film something take granted huge crowd pleaser 1928
1345,however after seeing the short again after about 25 years i was amazed at how timeless the film actually is  ,1,"['however', 'seeing', 'short', '25', 'years', 'amazed', 'timeless', 'film', 'actually']",however seeing short years amazed timeless film actually,however seeing short years amazed timeless film actually,however seeing short years amazed timeless film actually
1346,it's just adorable seeing mickey playing turkey in the straw in a highly imaginative (if occasionally cruel) way  ,1,"['adorable', 'seeing', 'mickey', 'playing', 'turkey', 'straw', 'highly', 'imaginative', 'occasionally', 'cruel', 'way']",adorable seeing mickey playing turkey straw highly imaginative occasionally cruel way,adorable seeing mickey playing turkey straw highly imaginative occasionally cruel way,adorable seeing mickey playing turkey straw highly imaginative occasionally cruel way
1347,clever and a real crowd-pleaser--this film still ranks among mickey's best films even after 80 wonderful years  ,1,"['clever', 'real', 'crowd', 'pleaser', 'film', 'still', 'ranks', 'among', 'mickey', 'best', 'films', 'even', '80', 'wonderful', 'years']",clever real crowd pleaser film still ranks among mickey best films even wonderful years,clever real crowd pleaser film still ranks among mickey best films even wonderful years,clever real crowd pleaser film still ranks among mickey best films even wonderful years
1348,the bipolarity of the ruthless thug (one minute a ruthless killer the next minute a luv's diaper commercial) is completely unconvincing  ,0,"['bipolarity', 'ruthless', 'thug', 'one', 'minute', 'ruthless', 'killer', 'next', 'minute', 'luv', 'diaper', 'commercial', 'completely', 'unconvincing']",bipolarity ruthless thug one minute ruthless killer next minute luv diaper commercial completely unconvincing,bipolarity ruthless thug one minute ruthless killer next minute luv diaper commercial completely unconvincing,bipolarity ruthless thug one minute ruthless killer next minute luv diaper commercial completely unconvincing
1349,i'm terribly disappointed that this film would receive so many awards and accolades especially when there are far more deserving works of film out there  ,0,"['terribly', 'disappointed', 'film', 'would', 'receive', 'many', 'awards', 'accolades', 'especially', 'far', 'deserving', 'works', 'film']",terribly disappointed film would receive many awards accolades especially far deserving works film,terribly disappointed film would receive many awards accolades especially far deserving works film,terribly disappointed film would receive many awards accolades especially far deserving works film
1350,the original body and soul (1947) is a masterpiece  ,1,"['original', 'body', 'soul', '1947', 'masterpiece']",original body soul 1947 masterpiece,original body soul 1947 masterpiece,original body soul 1947 masterpiece
1351,john garfield ann revere lilli plmer william conrad canada leeand filmed by one of the greatest cinematographers to ever grace the screenjames wong howe  ,1,"['john', 'garfield', 'ann', 'revere', 'lilli', 'plmer', 'william', 'conrad', 'canada', 'leeand', 'filmed', 'one', 'greatest', 'cinematographers', 'ever', 'grace', 'screenjames', 'wong', 'howe']",john garfield ann revere lilli plmer william conrad canada leeand filmed one greatest cinematographers ever grace screenjames wong howe,john garfield ann revere lilli plmer william conrad canada leeand filmed one greatest cinematographers ever grace screenjames wong howe,john garfield ann revere lilli plmer william conrad canada leeand filmed one greatest cinematographers ever grace screenjames wong howe
1352,i don't think there are any redeeming qualities in this remake  ,0,"['think', 'redeeming', 'qualities', 'remake']",think redeeming qualities remake,think redeeming qualities remake,think redeeming qualities remake
1353,this may be the only bad film he ever made  ,0,"['may', 'bad', 'film', 'ever', 'made']",may bad film ever made,may bad film ever made,may bad film ever made
1354,so badwellit's just bad  ,0,"['badwellit', 'bad']",badwellit bad,badwellit bad,badwellit bad
1355,this movie is a solid example of a bad plot and a very very bad idea all the way  ,0,"['movie', 'solid', 'example', 'bad', 'plot', 'bad', 'idea', 'way']",movie solid example bad plot bad idea way,movie solid example bad plot bad idea way,movie solid example bad plot bad idea way
1356,it's a shame to see good actors like thomerson and james make a living in a mess like this  ,0,"['shame', 'see', 'good', 'actors', 'like', 'thomerson', 'james', 'make', 'living', 'mess', 'like']",shame see good actors like thomerson james make living mess like,shame see good actors like thomerson james make living mess like,shame see good actors like thomerson james make living mess like
1357,i thought it was bad  ,0,"['thought', 'bad']",thought bad,thought bad,thought bad
1358,both films are terrible but to the credit of the 1986 version it was watchable  ,0,"['films', 'terrible', 'credit', '1986', 'version', 'watchable']",films terrible credit 1986 version watchable,films terrible credit 1986 version watchable,films terrible credit 1986 version watchable
1359,let's start with all the problemsthe acting especially from the lead professor was very very bad  ,0,"['let', 'start', 'problems', 'acting', 'especially', 'lead', 'professor', 'bad']",let start problems acting especially lead professor bad,let start problems acting especially lead professor bad,let start problems acting especially lead professor bad
1360,the script is a big flawed mess  ,0,"['script', 'big', 'flawed', 'mess']",script big flawed mess,script big flawed mess,script big flawed mess
1361,the best example of how dumb the writing is when it's established that you can turn the zombie-students back into humans by removing a necklace containing a piece of the meteorite  ,0,"['best', 'example', 'dumb', 'writing', 'established', 'turn', 'zombie', 'students', 'back', 'humans', 'removing', 'necklace', 'containing', 'piece', 'meteorite']",best example dumb writing established turn zombie students back humans removing necklace containing piece meteorite,best example dumb writing established turn zombie students back humans removing necklace containing piece meteorite,best example dumb writing established turn zombie students back humans removing necklace containing piece meteorite
1362,director paul matthews who also wrote/directed the weak 1995 monster movie grim clearly doesn't know how to pace his films  ,0,"['director', 'paul', 'matthews', 'also', 'wrote', 'directed', 'weak', '1995', 'monster', 'movie', 'grim', 'clearly', 'know', 'pace', 'films']",director paul matthews also wrote directed weak 1995 monster movie grim clearly know pace films,director paul matthews also wrote directed weak 1995 monster movie grim clearly know pace films,director paul matthews also wrote directed weak 1995 monster movie grim clearly know pace films
1363,the movie is terribly boring in places  ,0,"['movie', 'terribly', 'boring', 'places']",movie terribly boring places,movie terribly boring places,movie terribly boring places
1364,the lighting is awful  ,0,"['lighting', 'awful']",lighting awful,lighting awful,lighting awful
1365,the film looks cheap and bland  ,0,"['film', 'looks', 'cheap', 'bland']",film looks cheap bland,film looks cheap bland,film looks cheap bland
1366,one of the most disappointing aspects is the lack of notable gore  ,0,"['one', 'disappointing', 'aspects', 'lack', 'notable', 'gore']",one disappointing aspects lack notable gore,one disappointing aspects lack notable gore,one disappointing aspects lack notable gore
1367,this convention never worked well in the past and certainly doesn't work here  ,0,"['convention', 'never', 'worked', 'well', 'past', 'certainly', 'work']",convention never worked well past certainly work,convention never worked well past certainly work,convention never worked well past certainly work
1368,the visual effects were awful  ,0,"['visual', 'effects', 'awful']",visual effects awful,visual effects awful,visual effects awful
1369,the cg opening sequence in space looked like it could have been created on microsoft slideshow for god's sake  ,0,"['cg', 'opening', 'sequence', 'space', 'looked', 'like', 'could', 'created', 'microsoft', 'slideshow', 'god', 'sake']",opening sequence space looked like could created microsoft slideshow god sake,opening sequence space looked like could created microsoft slideshow god sake,opening sequence space looked like could created microsoft slideshow god sake
1370,the explosion of the gas tanks at the end was just as awful  ,0,"['explosion', 'gas', 'tanks', 'end', 'awful']",explosion gas tanks end awful,explosion gas tanks end awful,explosion gas tanks end awful
1371,okay i like to consider myself a fair critic so i'll give credit where credit's due--the creature effects were actually pretty cool  ,1,"['okay', 'like', 'consider', 'fair', 'critic', 'give', 'credit', 'credit', 'due', 'creature', 'effects', 'actually', 'pretty', 'cool']",okay like consider fair critic give credit credit due creature effects actually pretty cool,okay like consider fair critic give credit credit due creature effects actually pretty cool,okay like consider fair critic give credit credit due creature effects actually pretty cool
1372,gotta love those close-ups of slimy drooling teeth  ,1,"['gotta', 'love', 'close', 'ups', 'slimy', 'drooling', 'teeth']",gotta love close ups slimy drooling teeth,love close ups slimy drooling teeth,love close ups slimy drooling teeth
1373,to sum the film up breeders is a terrible cheaply made horror movie that should be avoided like the ebola virus  ,0,"['sum', 'film', 'breeders', 'terrible', 'cheaply', 'made', 'horror', 'movie', 'avoided', 'like', 'ebola', 'virus']",sum film breeders terrible cheaply made horror movie avoided like ebola virus,sum film breeders terrible cheaply made horror movie avoided like ebola virus,sum film breeders terrible cheaply made horror movie avoided like ebola virus
1374,not recommended  ,0,['recommended'],recommended,recommended,recommended
1375,he is almost unbearable to watch on screen he has little to no charisma and terrible comedic timing  ,0,"['almost', 'unbearable', 'watch', 'screen', 'little', 'charisma', 'terrible', 'comedic', 'timing']",almost unbearable watch screen little charisma terrible comedic timing,almost unbearable watch screen little charisma terrible comedic timing,almost unbearable watch screen little charisma terrible comedic timing
1376,aside from it's terrible lead this film has loads of other debits  ,0,"['aside', 'terrible', 'lead', 'film', 'loads', 'debits']",aside terrible lead film loads debits,aside terrible lead film loads debits,aside terrible lead film loads debits
1377,i understand that it's supposed to be a cheap popcorn comedy but that doesn't mean that it has to completely insult our intelligence and have writing so incredibly hackneyed that it borders on offensive  ,0,"['understand', 'supposed', 'cheap', 'popcorn', 'comedy', 'mean', 'completely', 'insult', 'intelligence', 'writing', 'incredibly', 'hackneyed', 'borders', 'offensive']",understand supposed cheap popcorn comedy mean completely insult intelligence writing incredibly hackneyed borders offensive,understand supposed cheap popcorn comedy mean completely insult intelligence writing incredibly hackneyed borders offensive,understand supposed cheap popcorn comedy mean completely insult intelligence writing incredibly hackneyed borders offensive
1378,lewis black's considerable talent is wasted here too as he is at his most incendiary when he is unrestrained which the pg-13 rating certainly won't allow  ,0,"['lewis', 'black', 'considerable', 'talent', 'wasted', 'incendiary', 'unrestrained', 'pg', '13', 'rating', 'certainly', 'allow']",lewis black considerable talent wasted incendiary unrestrained rating certainly allow,lewis black considerable talent wasted incendiary unrestrained rating certainly allow,lewis black considerable talent wasted incendiary unrestrained rating certainly allow
1379,the film's sole bright spot was jonah hill (who will look almost unrecognizable to fans of the recent superbad due to the amount of weight he lost in the interim)  ,1,"['film', 'sole', 'bright', 'spot', 'jonah', 'hill', 'look', 'almost', 'unrecognizable', 'fans', 'recent', 'superbad', 'due', 'amount', 'weight', 'lost', 'interim']",film sole bright spot jonah hill look almost unrecognizable fans recent superbad due amount weight lost interim,film sole bright spot jonah hill look almost unrecognizable fans recent superbad due amount weight lost interim,film sole bright spot jonah hill look almost unrecognizable fans recent superbad due amount weight lost interim
1380,with the originality and freshness of the first movie now spent this remake had little else to offer  ,0,"['originality', 'freshness', 'first', 'movie', 'spent', 'remake', 'little', 'else', 'offer']",originality freshness first movie spent remake little else offer,originality freshness first movie spent remake little else offer,originality freshness first movie spent remake little else offer
1381,the budget was evidently very limited  ,0,"['budget', 'evidently', 'limited']",budget evidently limited,budget evidently limited,budget evidently limited
1382,this was reflected not only in the cast but also in the below-par script which borrowed much from the earlier classic  ,0,"['reflected', 'cast', 'also', 'par', 'script', 'borrowed', 'much', 'earlier', 'classic']",reflected cast also par script borrowed much earlier classic,reflected cast also par script borrowed much earlier classic,reflected cast also par script borrowed much earlier classic
1383,however here there was no decent acting action or location work to balance things up  ,0,"['however', 'decent', 'acting', 'action', 'location', 'work', 'balance', 'things']",however decent acting action location work balance things,however decent acting action location work balance things,however decent acting action location work balance things
1384,filmiing was less expansive  ,0,"['filmiing', 'less', 'expansive']",filmiing less expansive,filmiing less expansive,filmiing less expansive
1385,it failed to convey the broad sweep of landscapes that were a great part of the original  ,0,"['failed', 'convey', 'broad', 'sweep', 'landscapes', 'great', 'part', 'original']",failed convey broad sweep landscapes great part original,failed convey broad sweep landscapes great part original,failed convey broad sweep landscapes great part original
1386,generally it just lacked imagination  ,0,"['generally', 'lacked', 'imagination']",generally lacked imagination,generally lacked imagination,generally lacked imagination
1387,not recommended  ,0,['recommended'],recommended,recommended,recommended
1388,is it possible for a movie to get any worse than this  ,0,"['possible', 'movie', 'get', 'worse']",possible movie get worse,possible movie get worse,possible movie get worse
1389,there is no plot here to keep you going in the first place  ,0,"['plot', 'keep', 'going', 'first', 'place']",plot keep going first place,plot keep going first place,plot keep going first place
1390,even when the women finally show up there is no sign of improvement the most expected things happen and by the time the film is over you might be far asleep  ,0,"['even', 'women', 'finally', 'show', 'sign', 'improvement', 'expected', 'things', 'happen', 'time', 'film', 'might', 'far', 'asleep']",even women finally show sign improvement expected things happen time film might far asleep,even women finally show sign improvement expected things happen time film might far asleep,even women finally show sign improvement expected things happen time film might far asleep
1391,beware this is not a trashy cult movie this is trash -period  ,0,"['beware', 'trashy', 'cult', 'movie', 'trash', 'period']",beware trashy cult movie trash period,beware trashy cult movie trash period,beware trashy cult movie trash period
1392,i can't believe there's even a sequel to this  ,0,"['believe', 'even', 'sequel']",believe even sequel,believe even sequel,believe even sequel
1393,which is precisely why i am giving it such a bad review  ,0,"['precisely', 'giving', 'bad', 'review']",precisely giving bad review,precisely giving bad review,precisely giving bad review
1394,being a 90's child i truly enjoyed this show and i can proudly say that i enjoyed it big time and even more than the classical wb cartoons  ,1,"['90', 'child', 'truly', 'enjoyed', 'show', 'proudly', 'say', 'enjoyed', 'big', 'time', 'even', 'classical', 'wb', 'cartoons']",child truly enjoyed show proudly say enjoyed big time even classical cartoons,child truly enjoyed show proudly say enjoyed big time even classical cartoons,child truly enjoyed show proudly say enjoyed big time even classical cartoons
1395,but tiny toons kept the 90's vibe and delivered one of the most popular funny and underrated cartoons ever created  ,1,"['tiny', 'toons', 'kept', '90', 'vibe', 'delivered', 'one', 'popular', 'funny', 'underrated', 'cartoons', 'ever', 'created']",tiny toons kept vibe delivered one popular funny underrated cartoons ever created,tiny toons kept vibe delivered one popular funny underrated cartoons ever created,tiny toons kept vibe delivered one popular funny underrated cartoons ever created
1396,the memories are murky but i can only say that i enjoyed every single episode and product related to the show  ,1,"['memories', 'murky', 'say', 'enjoyed', 'every', 'single', 'episode', 'product', 'related', 'show']",memories murky say enjoyed every single episode product related show,memories murky say enjoyed every single episode product related show,memories murky say enjoyed every single episode product related show
1397,easily none other cartoon made me laugh in a tender way (before getting into dark sitcoms oriented for teenagers)  ,1,"['easily', 'none', 'cartoon', 'made', 'laugh', 'tender', 'way', 'getting', 'dark', 'sitcoms', 'oriented', 'teenagers']",easily none cartoon made laugh tender way getting dark sitcoms oriented teenagers,easily none cartoon made laugh tender way getting dark sitcoms oriented teenagers,easily none cartoon made laugh tender way getting dark sitcoms oriented teenagers
1398,the characters were all funny and had the peculiarity of not having a true lead character  ,1,"['characters', 'funny', 'peculiarity', 'true', 'lead', 'character']",characters funny peculiarity true lead character,characters funny peculiarity true lead character,characters funny peculiarity true lead character
1399,every single character was hilarious and deserved to be called a lead  ,1,"['every', 'single', 'character', 'hilarious', 'deserved', 'called', 'lead']",every single character hilarious deserved called lead,every single character hilarious deserved called lead,every single character hilarious deserved called lead
1400,every element of this story was so over the top excessively phony and contrived that it was painful to sit through  ,0,"['every', 'element', 'story', 'top', 'excessively', 'phony', 'contrived', 'painful', 'sit']",every element story top excessively phony contrived painful sit,every element story top excessively phony contrived painful sit,every element story top excessively phony contrived painful sit
1401,her lines seem to have been written by a fifteen year old though they are trying oh so so hard to sound like how a fifteen year old would really um you know well talk  ,0,"['lines', 'seem', 'written', 'fifteen', 'year', 'old', 'though', 'trying', 'oh', 'hard', 'sound', 'like', 'fifteen', 'year', 'old', 'would', 'really', 'um', 'know', 'well', 'talk']",lines seem written fifteen year old though trying hard sound like fifteen year old would really know well talk,lines seem written fifteen year old though trying hard sound like fifteen year old would really know well talk,lines seem written fifteen year old though trying hard sound like fifteen year old would really know well talk
1402,perabo has a nice energy level and is obviously very comfortable in front of a camera  ,1,"['perabo', 'nice', 'energy', 'level', 'obviously', 'comfortable', 'front', 'camera']",perabo nice energy level obviously comfortable front camera,perabo nice energy level obviously comfortable front camera,perabo nice energy level obviously comfortable front camera
1403,there is simply no excuse for something this poorly done  ,0,"['simply', 'excuse', 'something', 'poorly', 'done']",simply excuse something poorly done,simply excuse something poorly done,simply excuse something poorly done
1404,i saw this movie and i thought this is a stupid movie  ,0,"['saw', 'movie', 'thought', 'stupid', 'movie']",saw movie thought stupid movie,saw movie thought stupid movie,saw movie thought stupid movie
1405,what is even more stupid is that who had thought an idea that there should be a volcano in los angeles  ,0,"['even', 'stupid', 'thought', 'idea', 'volcano', 'los', 'angeles']",even stupid thought idea volcano los angeles,even stupid thought idea volcano los angeles,even stupid thought idea volcano los angeles
1406,to be honest with you this is unbelievable nonsense and very foolish  ,0,"['honest', 'unbelievable', 'nonsense', 'foolish']",honest unbelievable nonsense foolish,honest unbelievable nonsense foolish,honest unbelievable nonsense foolish
1407,in conclusion i will not bother with this movie because a volcano in los angeles is nothing but nonsense  ,0,"['conclusion', 'bother', 'movie', 'volcano', 'los', 'angeles', 'nothing', 'nonsense']",conclusion bother movie volcano los angeles nothing nonsense,conclusion bother movie volcano los angeles nothing nonsense,conclusion bother movie volcano los angeles nothing nonsense
1408,the story line is just awful  ,0,"['story', 'line', 'awful']",story line awful,story line awful,story line awful
1409,it's just painful  ,0,['painful'],painful,painful,painful
1410,and the accents are absolutely abysmal  ,0,"['accents', 'absolutely', 'abysmal']",accents absolutely abysmal,accents absolutely abysmal,accents absolutely abysmal
1411,there's also enough hypocrisy in this film to make me vomit  ,0,"['also', 'enough', 'hypocrisy', 'film', 'make', 'vomit']",also enough hypocrisy film make vomit,also enough hypocrisy film make vomit,also enough hypocrisy film make vomit
1412,don't waste your time watching this rubbish non-researched film  ,0,"['waste', 'time', 'watching', 'rubbish', 'non', 'researched', 'film']",waste time watching rubbish non researched film,waste time watching rubbish non researched film,waste time watching rubbish non researched film
1413,i believe that pitch black was done well  ,1,"['believe', 'pitch', 'black', 'done', 'well']",believe pitch black done well,believe pitch black done well,believe pitch black done well
1414,the characters are interesting and you want to find out more about them the longer the movie goes on and i think people will be surprised by who does and doesn't make it  ,1,"['characters', 'interesting', 'want', 'find', 'longer', 'movie', 'goes', 'think', 'people', 'surprised', 'make']",characters interesting want find longer movie goes think people surprised make,characters interesting want find longer movie goes think people surprised make,characters interesting want find longer movie goes think people surprised make
1415,go watch it  ,1,"['go', 'watch']",watch,watch,watch
