,text,label,text_token,text_string,text_string_fdist,text_string_lem
928,makes it easier to keep up with my bluetooth when i'm not wearing it,0,"['makes', 'easier', 'keep', 'bluetooth', 'wearing']",makes easier keep bluetooth wearing,makes easier keep bluetooth wearing,makes easier keep bluetooth wearing
929,as i said abovepretty useless,0,"['said', 'abovepretty', 'useless']",said abovepretty useless,said abovepretty useless,said abovepretty useless
930,never got it,0,"['never', 'got']",never got,never got,never got
931,this pair of headphones is the worst that i have ever had sound-wise,0,"['pair', 'headphones', 'worst', 'ever', 'sound', 'wise']",pair headphones worst ever sound wise,pair headphones worst ever sound wise,pair headphones worst ever sound wise
932,[] down the drain because of a weak snap,0,"['drain', 'weak', 'snap']",drain weak snap,drain weak snap,drain weak snap
933,does not charge the cingular (att) 8525 phone,0,"['charge', 'cingular', 'att', '8525', 'phone']",charge cingular att 8525 phone,charge cingular att 8525 phone,charge cingular att 8525 phone
934,you get extra minutes so that you can carry out the call and not get cut off,1,"['get', 'extra', 'minutes', 'carry', 'call', 'get', 'cut']",get extra minutes carry call get cut,get extra minutes carry call get cut,get extra minutes carry call get cut
935,however after about a year the fliptop started to get loose and wobbly and eventually my screen went black and i couldn't receive and place calls,0,"['however', 'year', 'fliptop', 'started', 'get', 'loose', 'wobbly', 'eventually', 'screen', 'went', 'black', 'receive', 'place', 'calls']",however year fliptop started get loose wobbly eventually screen went black receive place calls,however year fliptop started get loose wobbly eventually screen went black receive place calls,however year fliptop started get loose wobbly eventually screen went black receive place calls
936,i kept catching the cable on the seat and i had to pull the phone out to turn it on an off,0,"['kept', 'catching', 'cable', 'seat', 'pull', 'phone', 'turn']",kept catching cable seat pull phone turn,kept catching cable seat pull phone turn,kept catching cable seat pull phone turn
937,the headset fulfills my requirements so i am happy with my purchase,1,"['headset', 'fulfills', 'requirements', 'happy', 'purchase']",headset fulfills requirements happy purchase,headset fulfills requirements happy purchase,headset fulfills requirements happy purchase
938,logitech bluetooth headset is a 10,1,"['logitech', 'bluetooth', 'headset', '10']",logitech bluetooth headset,logitech bluetooth headset,logitech bluetooth headset
939,i like the fact that it rests lightly against your ear rather than inside,1,"['like', 'fact', 'rests', 'lightly', 'ear', 'rather', 'inside']",like fact rests lightly ear rather inside,like fact rests lightly ear rather inside,like fact rests lightly ear rather inside
940,a lot of websites have been rating this a very good phone and so do i,1,"['lot', 'websites', 'rating', 'good', 'phone']",lot websites rating good phone,lot websites rating good phone,lot websites rating good phone
941,i have tried these cables with my computer and my ipod and it works just fine,1,"['tried', 'cables', 'computer', 'ipod', 'works', 'fine']",tried cables computer ipod works fine,tried cables computer ipod works fine,tried cables computer ipod works fine
942,the mic there is a joke and the volume is quite low,0,"['mic', 'joke', 'volume', 'quite', 'low']",mic joke volume quite low,mic joke volume quite low,mic joke volume quite low
943,i'm returning them,0,['returning'],returning,returning,returning
944,i does not maintain a connection with the computer while it is on my lap,0,"['maintain', 'connection', 'computer', 'lap']",maintain connection computer lap,maintain connection computer lap,maintain connection computer lap
945,it is easy to turn on and off when you are in the car and the volume controls are quite accessable,1,"['easy', 'turn', 'car', 'volume', 'controls', 'quite', 'accessable']",easy turn car volume controls quite accessable,easy turn car volume controls quite accessable,easy turn car volume controls quite accessable
946,i have had mine for about a year and this christmas i bought some for the rest of the family,1,"['mine', 'year', 'christmas', 'bought', 'rest', 'family']",mine year christmas bought rest family,mine year christmas bought rest family,mine year christmas bought rest family
947,otherwise easy to install and use clear sound,1,"['otherwise', 'easy', 'install', 'use', 'clear', 'sound']",otherwise easy install use clear sound,otherwise easy install use clear sound,otherwise easy install use clear sound
948,nice leather,1,"['nice', 'leather']",nice leather,nice leather,nice leather
949,i had to purchase a different case,0,"['purchase', 'different', 'case']",purchase different case,purchase different case,purchase different case
950,it is a joy to use,1,"['joy', 'use']",joy use,joy use,joy use
951,very much disappointed with this company,0,"['much', 'disappointed', 'company']",much disappointed company,much disappointed company,much disappointed company
952,very satisifed with that,1,['satisifed'],satisifed,satisifed,satisifed
953,it didn't charge for me,0,['charge'],charge,charge,charge
954,this is the phone to get for 2005 i just bought my s710a and all i can say is wow,1,"['phone', 'get', '2005', 'bought', 's710a', 'say', 'wow']",phone get 2005 bought s710a say wow,phone get 2005 bought s710a say wow,phone get 2005 bought s710a say wow
955,buttons are too small,0,"['buttons', 'small']",buttons small,buttons small,buttons small
956,just reading on the specs alone makes you say wow,1,"['reading', 'specs', 'alone', 'makes', 'say', 'wow']",reading specs alone makes say wow,reading specs alone makes say wow,reading specs alone makes say wow
957,love it great armband,1,"['love', 'great', 'armband']",love great armband,love great armband,love great armband
958,i really like this product over the motorola because it is allot clearer on the ear piece and the mic,1,"['really', 'like', 'product', 'motorola', 'allot', 'clearer', 'ear', 'piece', 'mic']",really like product motorola allot clearer ear piece mic,really like product motorola allot clearer ear piece mic,really like product motorola allot clearer ear piece mic
959,however the keypads are so tinny that i sometimes reach the wrong buttons,0,"['however', 'keypads', 'tinny', 'sometimes', 'reach', 'wrong', 'buttons']",however keypads tinny sometimes reach wrong buttons,however keypads tinny sometimes reach wrong buttons,however keypads tinny sometimes reach wrong buttons
960,i exchanged the sony ericson z500a for this and i'm pretty happy with that decision,1,"['exchanged', 'sony', 'ericson', 'z500a', 'pretty', 'happy', 'decision']",exchanged sony ericson z500a pretty happy decision,exchanged sony ericson z500a pretty happy decision,exchanged sony ericson z500a pretty happy decision
961,i was very impressed with the price of the cases,1,"['impressed', 'price', 'cases']",impressed price cases,impressed price cases,impressed price cases
962,also makes it easier to hold on to,1,"['also', 'makes', 'easier', 'hold']",also makes easier hold,also makes easier hold,also makes easier hold
963,i use this product in a motor control center where there is a lot of high voltage humming from the equipment and it works great,1,"['use', 'product', 'motor', 'control', 'center', 'lot', 'high', 'voltage', 'humming', 'equipment', 'works', 'great']",use product motor control center lot high voltage humming equipment works great,use product motor control center lot high voltage humming equipment works great,use product motor control center lot high voltage humming equipment works great
964,it's pretty easy,1,"['pretty', 'easy']",pretty easy,pretty easy,pretty easy
965,i cannot make calls at certain places,0,"['cannot', 'make', 'calls', 'certain', 'places']",cannot make calls certain places,make calls certain places,make calls certain places
966,however my girl was complain that some time the phone doesn't wake up like normal phone does,0,"['however', 'girl', 'complain', 'time', 'phone', 'wake', 'like', 'normal', 'phone']",however girl complain time phone wake like normal phone,however girl complain time phone wake like normal phone,however girl complain time phone wake like normal phone
967,beautiful styling though,1,"['beautiful', 'styling', 'though']",beautiful styling though,beautiful styling though,beautiful styling though
968,this company charge me a restocking fee and still not given me my refund back,0,"['company', 'charge', 'restocking', 'fee', 'still', 'given', 'refund', 'back']",company charge restocking fee still given refund back,company charge restocking fee still given refund back,company charge restocking fee still given refund back
969,i'm trying to return it for a refund,0,"['trying', 'return', 'refund']",trying return refund,trying return refund,trying return refund
970,i plugged it in only to find out not a darn thing worked,0,"['plugged', 'find', 'darn', 'thing', 'worked']",plugged find darn thing worked,plugged find darn thing worked,plugged find darn thing worked
971,excellent product,1,"['excellent', 'product']",excellent product,excellent product,excellent product
972,earbud piece breaks easily,0,"['earbud', 'piece', 'breaks', 'easily']",earbud piece breaks easily,earbud piece breaks easily,earbud piece breaks easily
973,lousy product,0,"['lousy', 'product']",lousy product,lousy product,lousy product
974,this phone tries very hard to do everything but fails at it's very ability to be a phone,0,"['phone', 'tries', 'hard', 'everything', 'fails', 'ability', 'phone']",phone tries hard everything fails ability phone,phone tries hard everything fails ability phone,phone tries hard everything fails ability phone
975,it is the best charger i have seen on the market yet,1,"['best', 'charger', 'seen', 'market', 'yet']",best charger seen market yet,best charger seen market yet,best charger seen market yet
976,sweetest phone,1,"['sweetest', 'phone']",sweetest phone,sweetest phone,sweetest phone
977,-)oh the charger seems to work fine,1,"['oh', 'charger', 'seems', 'work', 'fine']",charger seems work fine,charger seems work fine,charger seems work fine
978,it fits so securely that the ear hook does not even need to be used and the sound is better directed through your ear canal,1,"['fits', 'securely', 'ear', 'hook', 'even', 'need', 'used', 'sound', 'better', 'directed', 'ear', 'canal']",fits securely ear hook even need used sound better directed ear canal,fits securely ear hook even need used sound better directed ear canal,fits securely ear hook even need used sound better directed ear canal
979,not enough volume,0,"['enough', 'volume']",enough volume,enough volume,enough volume
980,echo problemvery unsatisfactory,0,"['echo', 'problemvery', 'unsatisfactory']",echo problemvery unsatisfactory,echo problemvery unsatisfactory,echo problemvery unsatisfactory
981,you could only take 2 videos at a time and the quality was very poor,0,"['could', 'take', '2', 'videos', 'time', 'quality', 'poor']",could take videos time quality poor,could take videos time quality poor,could take videos time quality poor
982,don't waste your money,0,"['waste', 'money']",waste money,waste money,waste money
983,i am going to have to be the first to negatively review this product,0,"['going', 'first', 'negatively', 'review', 'product']",going first negatively review product,going first negatively review product,going first negatively review product
984,adapter does not provide enough charging current,0,"['adapter', 'provide', 'enough', 'charging', 'current']",adapter provide enough charging current,adapter provide enough charging current,adapter provide enough charging current
985,there was so much hype over this phone that i assumed it was the best my mistake,0,"['much', 'hype', 'phone', 'assumed', 'best', 'mistake']",much hype phone assumed best mistake,much hype phone assumed best mistake,much hype phone assumed best mistake
986,you also cannot take pictures with it in the case because the lense is covered,0,"['also', 'cannot', 'take', 'pictures', 'case', 'lense', 'covered']",also cannot take pictures case lense covered,also take pictures case lense covered,also take pictures case lense covered
987,phone falls out easily,0,"['phone', 'falls', 'easily']",phone falls easily,phone falls easily,phone falls easily
988,it didn't work people can not hear me when i talk,0,"['work', 'people', 'hear', 'talk']",work people hear talk,work people hear talk,work people hear talk
989,the text messaging feature is really tricky to use,0,"['text', 'messaging', 'feature', 'really', 'tricky', 'use']",text messaging feature really tricky use,text messaging feature really tricky use,text messaging feature really tricky use
990,i'm really disappointed all i have now is a charger that doesn't work,0,"['really', 'disappointed', 'charger', 'work']",really disappointed charger work,really disappointed charger work,really disappointed charger work
991,painful on the ear,0,"['painful', 'ear']",painful ear,painful ear,painful ear
992,lasted one day and then blew up,0,"['lasted', 'one', 'day', 'blew']",lasted one day blew,lasted one day blew,lasted one day blew
993,disappointed,0,['disappointed'],disappointed,disappointed,disappointed
994,kind of flops around,0,"['kind', 'flops', 'around']",kind flops around,kind flops around,kind flops around
995,the screen does get smudged easily because it touches your ear and face,0,"['screen', 'get', 'smudged', 'easily', 'touches', 'ear', 'face']",screen get smudged easily touches ear face,screen get smudged easily touches ear face,screen get smudged easily touches ear face
996,what a piece of junk i lose more calls on this phone,0,"['piece', 'junk', 'lose', 'calls', 'phone']",piece junk lose calls phone,piece junk lose calls phone,piece junk lose calls phone
997,item does not match picture,0,"['item', 'match', 'picture']",item match picture,item match picture,item match picture
998,the only thing that disappoint me is the infra red port (irda),0,"['thing', 'disappoint', 'infra', 'red', 'port', 'irda']",thing disappoint infra red port irda,thing disappoint infra red port irda,thing disappoint infra red port irda
999,you can not answer calls with the unit never worked once,0,"['answer', 'calls', 'unit', 'never', 'worked']",answer calls unit never worked,answer calls unit never worked,answer calls unit never worked
1000,a very very very slow-moving aimless movie about a distressed drifting young man  ,0,"['slow', 'moving', 'aimless', 'movie', 'distressed', 'drifting', 'young', 'man']",slow moving aimless movie distressed drifting young man,slow moving aimless movie distressed drifting young man,slow moving aimless movie distressed drifting young man
1001,not sure who was more lost - the flat characters or the audience nearly half of whom walked out  ,0,"['sure', 'lost', 'flat', 'characters', 'audience', 'nearly', 'half', 'walked']",sure lost flat characters audience nearly half walked,sure lost flat characters audience nearly half walked,sure lost flat characters audience nearly half walked
1002,attempting artiness with black & white and clever camera angles the movie disappointed - became even more ridiculous - as the acting was poor and the plot and lines almost non-existent  ,0,"['attempting', 'artiness', 'black', 'white', 'clever', 'camera', 'angles', 'movie', 'disappointed', 'became', 'even', 'ridiculous', 'acting', 'poor', 'plot', 'lines', 'almost', 'non', 'existent']",attempting artiness black white clever camera angles movie disappointed became even ridiculous acting poor plot lines almost non existent,attempting artiness black white clever camera angles movie disappointed became even ridiculous acting poor plot lines almost non existent,attempting artiness black white clever camera angles movie disappointed became even ridiculous acting poor plot lines almost non existent
1003,very little music or anything to speak of  ,0,"['little', 'music', 'anything', 'speak']",little music anything speak,little music anything speak,little music anything speak
1004,the best scene in the movie was when gerardo is trying to find a song that keeps running through his head  ,1,"['best', 'scene', 'movie', 'gerardo', 'trying', 'find', 'song', 'keeps', 'running', 'head']",best scene movie gerardo trying find song keeps running head,best scene movie gerardo trying find song keeps running head,best scene movie gerardo trying find song keeps running head
1005,the rest of the movie lacks art charm meaning if it's about emptiness it works i guess because it's empty  ,0,"['rest', 'movie', 'lacks', 'art', 'charm', 'meaning', 'emptiness', 'works', 'guess', 'empty']",rest movie lacks art charm meaning emptiness works guess empty,rest movie lacks art charm meaning emptiness works guess empty,rest movie lacks art charm meaning emptiness works guess empty
1006,wasted two hours  ,0,"['wasted', 'two', 'hours']",wasted two hours,wasted two hours,wasted two hours
1007,saw the movie today and thought it was a good effort good messages for kids  ,1,"['saw', 'movie', 'today', 'thought', 'good', 'effort', 'good', 'messages', 'kids']",saw movie today thought good effort good messages kids,saw movie today thought good effort good messages kids,saw movie today thought good effort good messages kids
1008,a bit predictable  ,0,"['bit', 'predictable']",bit predictable,bit predictable,bit predictable
1009,loved the casting of jimmy buffet as the science teacher  ,1,"['loved', 'casting', 'jimmy', 'buffet', 'science', 'teacher']",loved casting jimmy buffet science teacher,loved casting jimmy buffet science teacher,loved casting jimmy buffet science teacher
1010,and those baby owls were adorable  ,1,"['baby', 'owls', 'adorable']",baby owls adorable,baby owls adorable,baby owls adorable
1011,the movie showed a lot of florida at it's best made it look very appealing  ,1,"['movie', 'showed', 'lot', 'florida', 'best', 'made', 'look', 'appealing']",movie showed lot florida best made look appealing,movie showed lot florida best made look appealing,movie showed lot florida best made look appealing
1012,the songs were the best and the muppets were so hilarious  ,1,"['songs', 'best', 'muppets', 'hilarious']",songs best muppets hilarious,songs best muppets hilarious,songs best muppets hilarious
1013,it was so cool  ,1,['cool'],cool,cool,cool
1014,this is a very right on case movie that delivers everything almost right in your face  ,1,"['right', 'case', 'movie', 'delivers', 'everything', 'almost', 'right', 'face']",right case movie delivers everything almost right face,right case movie delivers everything almost right face,right case movie delivers everything almost right face
1015,it had some average acting from the main person and it was a low budget as you clearly can see  ,0,"['average', 'acting', 'main', 'person', 'low', 'budget', 'clearly', 'see']",average acting main person low budget clearly see,average acting main person low budget clearly see,average acting main person low budget clearly see
1016,this review is long overdue since i consider a tale of two sisters to be the single greatest film ever made  ,1,"['review', 'long', 'overdue', 'since', 'consider', 'tale', 'two', 'sisters', 'single', 'greatest', 'film', 'ever', 'made']",review long overdue since consider tale two sisters single greatest film ever made,review long overdue since consider tale two sisters single greatest film ever made,review long overdue since consider tale two sisters single greatest film ever made
1017,i'll put this gem up against any movie in terms of screenplay cinematography acting post-production editing directing or any other aspect of film-making  ,1,"['put', 'gem', 'movie', 'terms', 'screenplay', 'cinematography', 'acting', 'post', 'production', 'editing', 'directing', 'aspect', 'film', 'making']",put gem movie terms screenplay cinematography acting post production editing directing aspect film making,put gem movie terms screenplay cinematography acting post production editing directing aspect film making,put gem movie terms screenplay cinematography acting post production editing directing aspect film making
1018,it's practically perfect in all of them  a true masterpiece in a sea of faux masterpieces  ,1,"['practically', 'perfect', 'true', 'masterpiece', 'sea', 'faux', 'masterpieces']",practically perfect true masterpiece sea faux masterpieces,practically perfect true masterpiece sea faux masterpieces,practically perfect true masterpiece sea faux masterpieces
