,text,label,text_token,text_string,text_string_fdist,text_string_lem
1851,i loved their mussels cooked in this wine reduction the duck was tender and their potato dishes were delicious,1,"['loved', 'mussels', 'cooked', 'wine', 'reduction', 'duck', 'tender', 'potato', 'dishes', 'delicious']",loved mussels cooked wine reduction duck tender potato dishes delicious,loved mussels cooked wine reduction duck tender potato dishes delicious,loved mussels cooked wine reduction duck tender potato dishes delicious
1852,this is one of the better buffets that i have been to,1,"['one', 'better', 'buffets']",one better buffets,one better buffets,one better buffets
1853,so we went to tigerlilly and had a fantastic afternoon,1,"['went', 'tigerlilly', 'fantastic', 'afternoon']",went tigerlilly fantastic afternoon,went tigerlilly fantastic afternoon,went tigerlilly fantastic afternoon
1854,the food was delicious our bartender was attentive and personable and we got a great deal,1,"['food', 'delicious', 'bartender', 'attentive', 'personable', 'got', 'great', 'deal']",food delicious bartender attentive personable got great deal,food delicious bartender attentive personable got great deal,food delicious bartender attentive personable got great deal
1855,the ambience is wonderful and there is music playing,1,"['ambience', 'wonderful', 'music', 'playing']",ambience wonderful music playing,ambience wonderful music playing,ambience wonderful music playing
1856,will go back next trip out,1,"['go', 'back', 'next', 'trip']",back next trip,back next trip,back next trip
1857,sooooo good,1,"['sooooo', 'good']",sooooo good,sooooo good,sooooo good
1858,real sushi lovers let's be honest - yama is not that good,0,"['real', 'sushi', 'lovers', 'let', 'honest', 'yama', 'good']",real sushi lovers let honest yama good,real sushi lovers let honest yama good,real sushi lovers let honest yama good
1859,at least 40min passed in between us ordering and the food arriving and it wasn't that busy,0,"['least', '40min', 'passed', 'us', 'ordering', 'food', 'arriving', 'busy']",least 40min passed ordering food arriving busy,least 40min passed ordering food arriving busy,least 40min passed ordering food arriving busy
1860,this is a really fantastic thai restaurant which is definitely worth a visit,1,"['really', 'fantastic', 'thai', 'restaurant', 'definitely', 'worth', 'visit']",really fantastic thai restaurant definitely worth visit,really fantastic thai restaurant definitely worth visit,really fantastic thai restaurant definitely worth visit
1861,nice spicy and tender,1,"['nice', 'spicy', 'tender']",nice spicy tender,nice spicy tender,nice spicy tender
1862,good prices,1,"['good', 'prices']",good prices,good prices,good prices
1863,check it out,1,['check'],check,check,check
1864,it was pretty gross,0,"['pretty', 'gross']",pretty gross,pretty gross,pretty gross
1865,i've had better atmosphere,0,"['better', 'atmosphere']",better atmosphere,better atmosphere,better atmosphere
1866,kind of hard to mess up a steak but they did,0,"['kind', 'hard', 'mess', 'steak']",kind hard mess steak,kind hard mess steak,kind hard mess steak
1867,although i very much liked the look and sound of this place the actual experience was a bit disappointing,0,"['although', 'much', 'liked', 'look', 'sound', 'place', 'actual', 'experience', 'bit', 'disappointing']",although much liked look sound place actual experience bit disappointing,although much liked look sound place actual experience bit disappointing,although much liked look sound place actual experience bit disappointing
1868,i just don't know how this place managed to served the blandest food i have ever eaten when they are preparing indian cuisine,0,"['know', 'place', 'managed', 'served', 'blandest', 'food', 'ever', 'eaten', 'preparing', 'indian', 'cuisine']",know place managed served blandest food ever eaten preparing indian cuisine,know place managed served blandest food ever eaten preparing indian cuisine,know place managed served blandest food ever eaten preparing indian cuisine
1869,worst service to boot but that is the least of their worries,0,"['worst', 'service', 'boot', 'least', 'worries']",worst service boot least worries,worst service boot least worries,worst service boot least worries
1870,service was fine and the waitress was friendly,1,"['service', 'fine', 'waitress', 'friendly']",service fine waitress friendly,service fine waitress friendly,service fine waitress friendly
1871,the guys all had steaks and our steak loving son who has had steak at the best and worst places said it was the best steak he's ever eaten,1,"['guys', 'steaks', 'steak', 'loving', 'son', 'steak', 'best', 'worst', 'places', 'said', 'best', 'steak', 'ever', 'eaten']",guys steaks steak loving son steak best worst places said best steak ever eaten,guys steaks steak loving son steak best worst places said best steak ever eaten,guys steaks steak loving son steak best worst places said best steak ever eaten
1872,we thought you'd have to venture further away to get good sushi but this place really hit the spot that night,1,"['thought', 'venture', 'away', 'get', 'good', 'sushi', 'place', 'really', 'hit', 'spot', 'night']",thought venture away get good sushi place really hit spot night,thought venture away get good sushi place really hit spot night,thought venture away get good sushi place really hit spot night
1873,host staff were for lack of a better word bitches,0,"['host', 'staff', 'lack', 'better', 'word', 'bitches']",host staff lack better word bitches,host staff lack better word bitches,host staff lack better word bitches
1874,bland not a liking this place for a number of reasons and i don't want to waste time on bad reviewing i'll leave it at that,0,"['bland', 'liking', 'place', 'number', 'reasons', 'want', 'waste', 'time', 'bad', 'reviewing', 'leave']",bland liking place number reasons want waste time bad reviewing leave,bland liking place number reasons want waste time bad reviewing leave,bland liking place number reasons want waste time bad reviewing leave
1875,phenomenal food service and ambiance,1,"['phenomenal', 'food', 'service', 'ambiance']",phenomenal food service ambiance,phenomenal food service ambiance,phenomenal food service ambiance
1876,i wouldn't return,0,['return'],return,return,return
1877,definitely worth venturing off the strip for the pork belly will return next time i'm in vegas,1,"['definitely', 'worth', 'venturing', 'strip', 'pork', 'belly', 'return', 'next', 'time', 'vegas']",definitely worth venturing strip pork belly return next time vegas,definitely worth venturing strip pork belly return next time vegas,definitely worth venturing strip pork belly return next time vegas
1878,this place is way too overpriced for mediocre food,0,"['place', 'way', 'overpriced', 'mediocre', 'food']",place way overpriced mediocre food,place way overpriced mediocre food,place way overpriced mediocre food
1879,penne vodka excellent,1,"['penne', 'vodka', 'excellent']",penne vodka excellent,penne vodka excellent,penne vodka excellent
1880,they have a good selection of food including a massive meatloaf sandwich a crispy chicken wrap a delish tuna melt and some tasty burgers,1,"['good', 'selection', 'food', 'including', 'massive', 'meatloaf', 'sandwich', 'crispy', 'chicken', 'wrap', 'delish', 'tuna', 'melt', 'tasty', 'burgers']",good selection food including massive meatloaf sandwich crispy chicken wrap delish tuna melt tasty burgers,good selection food including massive meatloaf sandwich crispy chicken wrap delish tuna melt tasty burgers,good selection food including massive meatloaf sandwich crispy chicken wrap delish tuna melt tasty burgers
1881,the management is rude,0,"['management', 'rude']",management rude,management rude,management rude
1882,delicious nyc bagels good selections of cream cheese real lox with capers even,1,"['delicious', 'nyc', 'bagels', 'good', 'selections', 'cream', 'cheese', 'real', 'lox', 'capers', 'even']",delicious nyc bagels good selections cream cheese real lox capers even,delicious nyc bagels good selections cream cheese real lox capers even,delicious nyc bagels good selections cream cheese real lox capers even
1883,great subway in fact it's so good when you come here every other subway will not meet your expectations,1,"['great', 'subway', 'fact', 'good', 'come', 'every', 'subway', 'meet', 'expectations']",great subway fact good come every subway meet expectations,great subway fact good come every subway meet expectations,great subway fact good come every subway meet expectations
1884,i had a seriously solid breakfast here,1,"['seriously', 'solid', 'breakfast']",seriously solid breakfast,seriously solid breakfast,seriously solid breakfast
1885,this is one of the best bars with food in vegas,1,"['one', 'best', 'bars', 'food', 'vegas']",one best bars food vegas,one best bars food vegas,one best bars food vegas
1886,he was extremely rude and really there are so many other restaurants i would love to dine at during a weekend in vegas,0,"['extremely', 'rude', 'really', 'many', 'restaurants', 'would', 'love', 'dine', 'weekend', 'vegas']",extremely rude really many restaurants would love dine weekend vegas,extremely rude really many restaurants would love dine weekend vegas,extremely rude really many restaurants would love dine weekend vegas
1887,my drink was never empty and he made some really great menu suggestions,1,"['drink', 'never', 'empty', 'made', 'really', 'great', 'menu', 'suggestions']",drink never empty made really great menu suggestions,drink never empty made really great menu suggestions,drink never empty made really great menu suggestions
1888,don't do it,0,[],,,
1889,the waiter wasn't helpful or friendly and rarely checked on us,0,"['waiter', 'helpful', 'friendly', 'rarely', 'checked', 'us']",waiter helpful friendly rarely checked,waiter helpful friendly rarely checked,waiter helpful friendly rarely checked
1890,my husband and i ate lunch here and were very disappointed with the food and service,0,"['husband', 'ate', 'lunch', 'disappointed', 'food', 'service']",husband ate lunch disappointed food service,husband ate lunch disappointed food service,husband ate lunch disappointed food service
1891,and the red curry had so much bamboo shoots and wasn't very tasty to me,0,"['red', 'curry', 'much', 'bamboo', 'shoots', 'tasty']",red curry much bamboo shoots tasty,red curry much bamboo shoots tasty,red curry much bamboo shoots tasty
1892,nice blanket of moz over top but i feel like this was done to cover up the subpar food,1,"['nice', 'blanket', 'moz', 'top', 'feel', 'like', 'done', 'cover', 'subpar', 'food']",nice blanket moz top feel like done cover subpar food,nice blanket moz top feel like done cover subpar food,nice blanket moz top feel like done cover subpar food
1893,the bathrooms are clean and the place itself is well decorated,1,"['bathrooms', 'clean', 'place', 'well', 'decorated']",bathrooms clean place well decorated,bathrooms clean place well decorated,bathrooms clean place well decorated
1894,the menu is always changing food quality is going down & service is extremely slow,0,"['menu', 'always', 'changing', 'food', 'quality', 'going', 'service', 'extremely', 'slow']",menu always changing food quality going service extremely slow,menu always changing food quality going service extremely slow,menu always changing food quality going service extremely slow
1895,the service was a little slow  considering that were served by 3 people servers so the food was coming in a slow pace,0,"['service', 'little', 'slow', 'considering', 'served', '3', 'people', 'servers', 'food', 'coming', 'slow', 'pace']",service little slow considering served people servers food coming slow pace,service little slow considering served people servers food coming slow pace,service little slow considering served people servers food coming slow pace
1896,i give it 2 thumbs down,0,"['give', '2', 'thumbs']",give thumbs,give thumbs,give thumbs
1897,we watched our waiter pay a lot more attention to other tables and ignore us,0,"['watched', 'waiter', 'pay', 'lot', 'attention', 'tables', 'ignore', 'us']",watched waiter pay lot attention tables ignore,watched waiter pay lot attention tables ignore,watched waiter pay lot attention tables ignore
1898,my fianc and i came in the middle of the day and we were greeted and seated right away,1,"['fianc', 'came', 'middle', 'day', 'greeted', 'seated', 'right', 'away']",fianc came middle day greeted seated right away,fianc came middle day greeted seated right away,fianc came middle day greeted seated right away
1899,this is a great restaurant at the mandalay bay,1,"['great', 'restaurant', 'mandalay', 'bay']",great restaurant mandalay bay,great restaurant mandalay bay,great restaurant mandalay bay
1900,we waited for forty five minutes in vain,0,"['waited', 'forty', 'five', 'minutes', 'vain']",waited forty five minutes vain,waited forty five minutes vain,waited forty five minutes vain
1901,crostini that came with the salad was stale,0,"['crostini', 'came', 'salad', 'stale']",crostini came salad stale,crostini came salad stale,crostini came salad stale
1902,some highlights  great quality nigiri here,1,"['highlights', 'great', 'quality', 'nigiri']",highlights great quality nigiri,highlights great quality nigiri,highlights great quality nigiri
1903,the staff is friendly and the joint is always clean,1,"['staff', 'friendly', 'joint', 'always', 'clean']",staff friendly joint always clean,staff friendly joint always clean,staff friendly joint always clean
1904,this was a different cut than the piece the other day but still wonderful and tender s well as well flavored,1,"['different', 'cut', 'piece', 'day', 'still', 'wonderful', 'tender', 'well', 'well', 'flavored']",different cut piece day still wonderful tender well well flavored,different cut piece day still wonderful tender well well flavored,different cut piece day still wonderful tender well well flavored
1905,i ordered the voodoo pasta and it was the first time i'd had really excellent pasta since going gluten free several years ago,1,"['ordered', 'voodoo', 'pasta', 'first', 'time', 'really', 'excellent', 'pasta', 'since', 'going', 'gluten', 'free', 'several', 'years', 'ago']",ordered voodoo pasta first time really excellent pasta since going gluten free several years ago,ordered voodoo pasta first time really excellent pasta since going gluten free several years ago,ordered voodoo pasta first time really excellent pasta since going gluten free several years ago
1906,this place is good,1,"['place', 'good']",place good,place good,place good
1907,unfortunately we must have hit the bakery on leftover day because everything we ordered was stale,0,"['unfortunately', 'must', 'hit', 'bakery', 'leftover', 'day', 'everything', 'ordered', 'stale']",unfortunately must hit bakery leftover day everything ordered stale,unfortunately must hit bakery leftover day everything ordered stale,unfortunately must hit bakery leftover day everything ordered stale
1908,i came back today since they relocated and still not impressed,0,"['came', 'back', 'today', 'since', 'relocated', 'still', 'impressed']",came back today since relocated still impressed,came back today since relocated still impressed,came back today since relocated still impressed
1909,i was seated immediately,1,"['seated', 'immediately']",seated immediately,seated immediately,seated immediately
1910,their menu is diverse and reasonably priced,1,"['menu', 'diverse', 'reasonably', 'priced']",menu diverse reasonably priced,menu diverse reasonably priced,menu diverse reasonably priced
1911,avoid at all cost,0,"['avoid', 'cost']",avoid cost,avoid cost,avoid cost
1912,restaurant is always full but never a wait,1,"['restaurant', 'always', 'full', 'never', 'wait']",restaurant always full never wait,restaurant always full never wait,restaurant always full never wait
1913,delicious,1,['delicious'],delicious,delicious,delicious
1914,this place is hands-down one of the best places to eat in the phoenix metro area,1,"['place', 'hands', 'one', 'best', 'places', 'eat', 'phoenix', 'metro', 'area']",place hands one best places eat phoenix metro area,place hands one best places eat phoenix metro area,place hands one best places eat phoenix metro area
1915,so don't go there if you are looking for good food,0,"['go', 'looking', 'good', 'food']",looking good food,looking good food,looking good food
1916,i've never been treated so bad,0,"['never', 'treated', 'bad']",never treated bad,never treated bad,never treated bad
1917,bacon is hella salty,1,"['bacon', 'hella', 'salty']",bacon hella salty,bacon hella salty,bacon hella salty
1918,we also ordered the spinach and avocado salad the ingredients were sad and the dressing literally had zero taste,0,"['also', 'ordered', 'spinach', 'avocado', 'salad', 'ingredients', 'sad', 'dressing', 'literally', 'zero', 'taste']",also ordered spinach avocado salad ingredients sad dressing literally zero taste,also ordered spinach avocado salad ingredients sad dressing literally zero taste,also ordered spinach avocado salad ingredients sad dressing literally zero taste
1919,this really is how vegas fine dining used to be right down to the menus handed to the ladies that have no prices listed,1,"['really', 'vegas', 'fine', 'dining', 'used', 'right', 'menus', 'handed', 'ladies', 'prices', 'listed']",really vegas fine dining used right menus handed ladies prices listed,really vegas fine dining used right menus handed ladies prices listed,really vegas fine dining used right menus handed ladies prices listed
1920,the waitresses are very friendly,1,"['waitresses', 'friendly']",waitresses friendly,waitresses friendly,waitresses friendly
1921,lordy the khao soi is a dish that is not to be missed for curry lovers,1,"['lordy', 'khao', 'soi', 'dish', 'missed', 'curry', 'lovers']",lordy khao soi dish missed curry lovers,lordy khao soi dish missed curry lovers,lordy khao soi dish missed curry lovers
1922,everything on the menu is terrific and we were also thrilled that they made amazing accommodations for our vegetarian daughter,1,"['everything', 'menu', 'terrific', 'also', 'thrilled', 'made', 'amazing', 'accommodations', 'vegetarian', 'daughter']",everything menu terrific also thrilled made amazing accommodations vegetarian daughter,everything menu terrific also thrilled made amazing accommodations vegetarian daughter,everything menu terrific also thrilled made amazing accommodations vegetarian daughter
1923,perhaps i caught them on an off night judging by the other reviews but i'm not inspired to go back,0,"['perhaps', 'caught', 'night', 'judging', 'reviews', 'inspired', 'go', 'back']",perhaps caught night judging reviews inspired back,perhaps caught night judging reviews inspired back,perhaps caught night judging reviews inspired back
1924,the service here leaves a lot to be desired,0,"['service', 'leaves', 'lot', 'desired']",service leaves lot desired,service leaves lot desired,service leaves lot desired
1925,the atmosphere is modern and hip while maintaining a touch of coziness,1,"['atmosphere', 'modern', 'hip', 'maintaining', 'touch', 'coziness']",atmosphere modern hip maintaining touch coziness,atmosphere modern hip maintaining touch coziness,atmosphere modern hip maintaining touch coziness
1926,not a weekly haunt but definitely a place to come back to every once in a while,1,"['weekly', 'haunt', 'definitely', 'place', 'come', 'back', 'every']",weekly haunt definitely place come back every,weekly haunt definitely place come back every,weekly haunt definitely place come back every
1927,we literally sat there for 20 minutes with no one asking to take our order,0,"['literally', 'sat', '20', 'minutes', 'one', 'asking', 'take', 'order']",literally sat minutes one asking take order,literally sat minutes one asking take order,literally sat minutes one asking take order
1928,the burger had absolutely no flavor - the meat itself was totally bland the burger was overcooked and there was no charcoal flavor,0,"['burger', 'absolutely', 'flavor', 'meat', 'totally', 'bland', 'burger', 'overcooked', 'charcoal', 'flavor']",burger absolutely flavor meat totally bland burger overcooked charcoal flavor,burger absolutely flavor meat totally bland burger overcooked charcoal flavor,burger absolutely flavor meat totally bland burger overcooked charcoal flavor
1929,i also decided not to send it back because our waitress looked like she was on the verge of having a heart attack,0,"['also', 'decided', 'send', 'back', 'waitress', 'looked', 'like', 'verge', 'heart', 'attack']",also decided send back waitress looked like verge heart attack,also decided send back waitress looked like verge heart attack,also decided send back waitress looked like verge heart attack
1930,i dressed up to be treated so rudely,0,"['dressed', 'treated', 'rudely']",dressed treated rudely,dressed treated rudely,dressed treated rudely
1931,it was probably dirt,0,"['probably', 'dirt']",probably dirt,probably dirt,probably dirt
1932,love this place hits the spot when i want something healthy but not lacking in quantity or flavor,1,"['love', 'place', 'hits', 'spot', 'want', 'something', 'healthy', 'lacking', 'quantity', 'flavor']",love place hits spot want something healthy lacking quantity flavor,love place hits spot want something healthy lacking quantity flavor,love place hits spot want something healthy lacking quantity flavor
1933,i ordered the lemon raspberry ice cocktail which was also incredible,1,"['ordered', 'lemon', 'raspberry', 'ice', 'cocktail', 'also', 'incredible']",ordered lemon raspberry ice cocktail also incredible,ordered lemon raspberry ice cocktail also incredible,ordered lemon raspberry ice cocktail also incredible
1934,the food sucked which we expected but it sucked more than we could have imagined,0,"['food', 'sucked', 'expected', 'sucked', 'could', 'imagined']",food sucked expected sucked could imagined,food sucked expected sucked could imagined,food sucked expected sucked could imagined
1935,interesting decor,1,"['interesting', 'decor']",interesting decor,interesting decor,interesting decor
1936,what i really like there is the crepe station,1,"['really', 'like', 'crepe', 'station']",really like crepe station,really like crepe station,really like crepe station
1937,also were served hot bread and butter and home made potato chips with bacon bits on topvery original and very good,1,"['also', 'served', 'hot', 'bread', 'butter', 'home', 'made', 'potato', 'chips', 'bacon', 'bits', 'topvery', 'original', 'good']",also served hot bread butter home made potato chips bacon bits topvery original good,also served hot bread butter home made potato chips bacon bits topvery original good,also served hot bread butter home made potato chips bacon bits topvery original good
1938,you can watch them preparing the delicious food),1,"['watch', 'preparing', 'delicious', 'food']",watch preparing delicious food,watch preparing delicious food,watch preparing delicious food
1939,both of the egg rolls were fantastic,1,"['egg', 'rolls', 'fantastic']",egg rolls fantastic,egg rolls fantastic,egg rolls fantastic
1940,when my order arrived one of the gyros was missing,0,"['order', 'arrived', 'one', 'gyros', 'missing']",order arrived one gyros missing,order arrived one gyros missing,order arrived one gyros missing
1941,i had a salad with the wings and some ice cream for dessert and left feeling quite satisfied,1,"['salad', 'wings', 'ice', 'cream', 'dessert', 'left', 'feeling', 'quite', 'satisfied']",salad wings ice cream dessert left feeling quite satisfied,salad wings ice cream dessert left feeling quite satisfied,salad wings ice cream dessert left feeling quite satisfied
1942,i'm not really sure how joey's was voted best hot dog in the valley by readers of phoenix magazine,0,"['really', 'sure', 'joey', 'voted', 'best', 'hot', 'dog', 'valley', 'readers', 'phoenix', 'magazine']",really sure joey voted best hot dog valley readers phoenix magazine,really sure joey voted best hot dog valley readers phoenix magazine,really sure joey voted best hot dog valley readers phoenix magazine
1943,the best place to go for a tasty bowl of pho,1,"['best', 'place', 'go', 'tasty', 'bowl', 'pho']",best place tasty bowl pho,best place tasty bowl pho,best place tasty bowl pho
1944,the live music on fridays totally blows,0,"['live', 'music', 'fridays', 'totally', 'blows']",live music fridays totally blows,live music fridays totally blows,live music fridays totally blows
1945,i've never been more insulted or felt disrespected,0,"['never', 'insulted', 'felt', 'disrespected']",never insulted felt disrespected,never insulted felt disrespected,never insulted felt disrespected
1946,very friendly staff,1,"['friendly', 'staff']",friendly staff,friendly staff,friendly staff
1947,it is worth the drive,1,"['worth', 'drive']",worth drive,worth drive,worth drive
1948,i had heard good things about this place but it exceeding every hope i could have dreamed of,1,"['heard', 'good', 'things', 'place', 'exceeding', 'every', 'hope', 'could', 'dreamed']",heard good things place exceeding every hope could dreamed,heard good things place exceeding every hope could dreamed,heard good things place exceeding every hope could dreamed
1949,food was great and so was the serivce,1,"['food', 'great', 'serivce']",food great serivce,food great serivce,food great serivce
1950,the warm beer didn't help,0,"['warm', 'beer', 'help']",warm beer help,warm beer help,warm beer help
1951,great brunch spot,1,"['great', 'brunch', 'spot']",great brunch spot,great brunch spot,great brunch spot
1952,service is friendly and inviting,1,"['service', 'friendly', 'inviting']",service friendly inviting,service friendly inviting,service friendly inviting
1953,very good lunch spot,1,"['good', 'lunch', 'spot']",good lunch spot,good lunch spot,good lunch spot
